title,article,author,provider,date
The Crypto Daily – The Movers and Shakers 03/07/19," Bitcoin continued its trend-bucking form on Tuesday to end a string of losses at the turn of the quarter. Bitcoin rose by 2.29% on Tuesday. Reversing a 1.48% fall from Monday, Bitcoin ended the day at $10,885. A bearish start to the day saw Bitcoin slide from a morning high $10,719 to a late morning intraday low $9,728.2. Falling short of the major resistance levels, Bitcoin fell through the first major support level at $10,075 to test support at the 38.2% FIB of $9,734 before bouncing back. Rallying through the afternoon, Bitcoin struck a late intraday high $10,965 before easing back. In spite of the afternoon rally, Bitcoin fell well short of the first major resistance level at $11,218. It was Bitcoin’s first visit to sub-$10,000 levels since 21st June. Across the rest of the top 10 cryptos, it was a sea of red across the crypto-board. Leading the way down was Binance Coin, which slid by 3.65%. Also seeing heavy losses were Litecoin (-3.26%), Tron (-2.89%), Bitcoin Cash ABC (-2.59%), and EOS (-2.37%). Ethereum and Bitcoin Cash SV saw more modest losses of 0.84% and 0.48% respectively. For Stellar’s Lumen, things haven’t improved since falling out of the top ten with a 2.16% loss on the day. With Bitcoin bucking the trend to see green on the day, Bitcoin’s dominance moved back to 61% levels. The total crypto market cap recovered from sub-$290 levels on Tuesday to end the day at $313.2bn. At the time of writing, Bitcoin was up by 2.73% to $11,182 as the bulls look to restore order. Moves within the first hour saw Bitcoin rise from a low $10,876 to a high $11,200 before easing back. While leaving the major support and resistance levels untested early on, Bitcoin came within range of the 23.6% FIB of $11,275. Elsewhere, it was a mixed start to the day for the majors. Ethereum tracked Bitcoin early on, with a 1.01% gain. Tron (+0.94%), Bitcoin Cash SV (+1.03%), and Litecoin (+1.18%) also made solid gains. Bucking the trend in the early hours, however, was Binance Coin with a 0.31% loss. Bitcoin would need to move through the 23.6% FIB of $11,257 to bring the first major resistance level at $11,323.93 into play. Having failed to touch $11,000 levels on Tuesday, the early move should support a bullish day ahead. An early break through the first major resistance level would bring $11,500 levels into play. Bitcoin would need the support of the broader market, however, to take a run at the second major resistance level at $11,762.87. Failure to move through the 23.6% FIB could see Bitcoin hit reverse. A fall back through to $10,500 levels would bring the first major support level at $10,087.13 into play. Barring a crypto meltdown, Bitcoin should steer clear of sub-$10,000 support levels on the day. Get Into Cryptocurrency Trading Today This article was originally posted on FX Empire",Bob Mason,FX Empire,2019-07-03T00:39:41.000Z
"Bitcoin Cash – ABC, Litecoin and Ripple Daily Analysis – 05/07/19"," Bitcoin Cash ABC slid by 5% on Thursday. Reversing a 2.25% gain from Wednesday, Bitcoin Cash ABC ended the day at $398.17. Relatively range-bound through most of the day, Bitcoin Cash ABC rose to a mid-morning intraday high $420.79 before falling to a late morning low $410.9. Whilst steering clear of the major support and resistance levels, Bitcoin Cash ABC fell back through the 23.6% FIB of $418. A brief visit to $419 levels was short-lived, with Bitcoin Cash ABC sliding to an intraday low $398.17 in the final hour of the day. The sell-off saw Bitcoin Cash ABC slide through the 23.6% FIB and first major support level at $407.36. At the time of writing, Bitcoin Cash ABC was up by 0.9% to $401.77. A relatively bullish start to the day saw Bitcoin Cash ABC rise from a morning low $396.33 to a high $402.01. Bitcoin Cash ABC left the major support and resistance levels untested early on. For the day ahead, Bitcoin Cash ABC would need to move through to $406 levels to support a run at the first major resistance level at $413.25. Bitcoin Cash ABC would need support from the broader market, however, to break through to $410 levels. In the event of a broad-based crypto rally, Bitcoin Cash ABC could take a run at $420 levels. Failure to move through to $406 levels could see Bitcoin Cash ABC hit reverse. A fall through the morning low $396.33 would bring the first major support level at $390.63 into play. Barring another crypto meltdown, Bitcoin Cash ABC should steer clear of sub-$390 support levels on the day. Litecoin fell by 1.8% on Thursday. Partially reversing 2.69% rise from Wednesday, Litecoin ended the day at $119.59. A bullish start to the day saw Litecoin rally from a morning low $119.03 to a late morning intraday high $127.37. Steering clear of the major support levels, Litecoin broke through the first major resistance level at $124.22 and second major resistance level at $126.66. After pulling back to $121 levels Litecoin managed a return to $126 levels before succumbing to market forces. A final hour sell-off saw Litecoin slide to an intraday low $118.59. In spite of the sell-off, Litecoin left the first major support level at $118.28 untested on the day. At the time of writing, Litecoin was down by 0.05% to $119.53. A mixed start to the day saw Litecoin rise from a low $118.5 to a high $120.14 before easing back. Litecoin left the major support and resistance levels untested early on. For the day ahead, a move through to $122 levels would support a run at the first major resistance level at $124.96. Litecoin would need the support of the broader market, however, to take a run at Thursday’s high $127.37. An early move through to $125 levels would bring the second major resistance level at $130.34 into play. Failure to move through to $122 levels could see Litecoin fall deeper into the red. A fall through the morning low $118.5 would bring the 23.6% FIB of $117 into play before any recovery. Barring a broad-based crypto sell-off, Litecoin should steer clear of the first major support level at $116.62. Ripple’s XRP slid by 4.47% on Thursday. Reversing a 1.33% from Wednesday, Ripple’s XRP ended the day at $0.38787. Bearish from the start of the day, Ripple’s XRP fell from an early intraday high $0.40659 to a late intraday low $0.3857. Falling short of the major resistance levels, Ripple’s XRP fell through the first major support level at $0.3984 and second major support level at $0.3914. At the time of writing, Ripple’s XRP was down by 0.01% to $0.38783. A bearish start to the day saw Ripple’s XRP fall from a morning high $0.3892 to a low $0.3844 before steadying. Ripple’s XRP left the major support and resistance levels untested early on. For the day ahead, a move through to $0.3935 levels would support a run at the first major resistance level at $0.4011. Ripple’s XRP would need the support of the broader market, however, for a break out from $0.3950 levels. Barring a broad-based crypto rally, Ripple’s XRP will likely come up short of $0.40 levels on the day. Failure to move through to $0.3935 levels could see Ripple’s XRP fall deeper into the red. A fall through the morning low $0.3844 would bring the first major support level at $0.3802 into play. An extended sell-off through the day could see Ripple’s XRP fall to sub-$0.38 levels before any recovery. Barring a crypto meltdown, however, Ripple’s XRP should steer clear of the second major support level at $0.3725. Please let us know what you think in the comments below Thanks, Bob This article was originally posted on FX Empire",Bob Mason,FX Empire,2019-07-05T01:54:37.000Z
Latest Bitcoin price and analysis (BTC to USD)," At the time of writing, Bitcoin (BTC) is trading just above $11,450 after price crashed close to 23% from $13,800 to $10,500 during the previous week. It seems the hypothesis that weekends are good for Bitcoin may not always be true, even though the price is now higher than it was one week ago as BTC consolidated above the key $11,000 level on Sunday. Will Bitcoin push higher during the week? Or will we see more major retracements back to the $10,000 region? Bitcoin is evolving as expected. Its overall value keeps increasing, and if you look at the volumes profile on the left of the graph above, you’ll notice there’s plenty of volume keeping BTC above the critical $11,000 level. My prediction that Bitcoin could hit $20,000 by the end of the year could turn into an “end of the month” kind of deal. Assuming the positive trend continues and BTC price continues to rise, we should expect higher volumes coming in at key levels close to $20,000. Although many retail investors will be looking to sell some of their gains when Bitcoin hits all-time highs again, we can expect the price to keep going at least for a few weeks. However, as the market becomes more liquid, we should expect fewer violent swings, so it could take longer for BTC to reach a new high. Let’s not forget that I consider Bitcoin to be in a bull run when the 20-day EMA is above the 50-day EMA and the latter is above the 200-day EMA. As we’ve already accomplished that goal – not only in shorter time frames but also in daily and weekly ones as well – I personally think the bears have retreated and bulls are now firmly in charge. Volume also seems to be increasing as well. Over the past two weeks, volume has gone from $17 billion to $23 billion, consolidating now around $20 billion. Putting all this information together, we’re now clearly on the right path to reach $15,000 – or maybe even $20,000 – by the end of 2019. Of course, if you think I might be overreacting to positive news, you can always check what other expert analysts have to say about this recent price movement. Hopefully, the market will continue this positive momentum. Pay attention to retracements back down towards the 200-day EMA to make new entries. Safe trades! Current live Bitcoin pricing information and interactive charts are available on our site 24 hours a day. The ticker bar at the bottom of every page on our site has the latest Bitcoin price. Pricing is also available in a range of different currency equivalents: US Dollar – BTCtoUSD British Pound Sterling – BTCtoGBP Japanese Yen – BTCtoJPY Euro – BTCtoEUR Australian Dollar – BTCtoAUD Russian Rouble – BTCtoRUB In August 2008, the domain name bitcoin.org was registered. On 31st October 2008, a paper was published called “Bitcoin: A Peer-to-Peer Electronic Cash System”. This was authored by Satoshi Nakamoto, the inventor of Bitcoin. To date, no one knows who this person, or people, are. The paper outlined a method of using a P2P network for electronic transactions without “relying on trust”. On 3rd January 2009, the Bitcoin network came into existence. Nakamoto mined block number “0” (or the “genesis block”), which had a reward of 50 Bitcoins. If you want to find out more information about Bitcoin or cryptocurrencies in general, then use the search box at the top of this page. Here’s an article to get you started. As with any investment, it pays to do some homework before you part with your money. The prices of cryptocurrencies are volatile and go up and down quickly. This page is not recommending a particular currency or whether you should invest or not. *The views and opinions expressed by the author should not be considered financial advisement. The author is not a professional trader, nor investor.  The post Latest Bitcoin price and analysis (BTC to USD) appeared first on Coin Rivet.",Pedro Febrero,Coin Rivet,2019-07-08T10:00:45.000Z
"Bitcoin Cash – ABC, Litecoin and Ripple Daily Analysis – 07/07/19"," Bitcoin Cash ABC rose by 1.59% on Saturday. Following on from a 0.46% gain from Friday, Bitcoin Cash ABC ended the day at $407.05. A mixed start to the day saw Bitcoin Cash ABC rise from an intraday low $400.67 to a morning high $406.43 before easing back to $401 levels. Steering clear of the major support and resistance levels, Bitcoin Cash ABC rallied to a late afternoon intraday high $416.8. Bitcoin Cash ABC broke through the first major resistance level at $409.98. Falling short of the 23.6% FIB of $418, Bitcoin Cash ABC pulled back to sub-$410 levels late in the day. At the time of writing, Bitcoin Cash ABC was down by 1.15% to a morning low $402.37. A mixed start to the day saw Bitcoin Cash ABC rise to a morning high $406.63 before falling into the red. Bitcoin Cash ABC left the major support and resistance levels untested early on. For the day ahead, a move through to $408 levels would support a run at the first major resistance level at $415.68. Barring a broad-based crypto rally, the first major resistance level and Saturday’s high $416.8 would cap any upside on the day. Failure to move through to $408 levels could see Bitcoin Cash ABC fall deeper into the red. A fall through the first major support level at $399.55 would bring the second major support level at $392.04 into play. Barring a crypto meltdown, Bitcoin Cash ABC should steer clear of sub-$390 levels. Litecoin slipped by 0.18% on Saturday. Following on from a 0.79% fall from Friday, Litecoin ended the day at $118.25. A bullish start to the day saw Litecoin hit a morning high $120.91. Coming up against the first major resistance level at $120.74 Litecoin pulled back to a morning low $118.18. Steering clear of the 23.6% FIB of $117 and first major support level at $116.27, Litecoin rallied to a late afternoon intraday high $122.29. Litecoin broke back through the first major resistance level at $120.74 before sliding to a late intraday low $117.3. Finding support at the 23.6% FIB of $117, Litecoin recovered to $118 levels to limit the downside on the day. At the time of writing, Litecoin was down by 0.18% to $118.04. A choppy start to the day saw Litecoin rise from a morning low $117.43 to a high $119.14 before easing back. Litecoin left the major support and resistance levels untested early on. For the day ahead, a move back through the morning high to $119.30 levels would support a run at the first major resistance level at $121.26. Litecoin would need the support of the broader market, however, to break clear of $120. Barring a broad-based crypto rally, Saturday’s high $122.29 should limit the upside on the day. Failure to move through to $119.30 levels could see Litecoin slide back to $117 levels. In the event of an extended sell-off, Litecoin could fall through the 23.6% FIB of $117 to test the first major support level at $116.37 before any recovery. Ripple’s XRP rallied by 3.08% on Saturday. Reversing a 2.15% fall from Friday, Ripple’s XRP ended the day at $0.39155. Tracking the broader market, Ripple’s XRP rose from an intraday low $0.37936 to a morning high $0.38738. Ripple’s XRP came within range the first major resistance level at $0.3878 before easing back to $0.381 levels. An early afternoon rally saw Ripple’s XRP strike an intraday high $0.41113 before sliding back to sub-$0.39 levels. The rally saw Ripple’s XRP break through the first major resistance level at $0.3878 and second major resistance level at $0.3061. Ripple’s XRP came up against the third major resistance level at $0.4112 before the reversal. At the time of writing, Ripple’s XRP was down by 0.6% to $0.38921. A bearish start to the day saw Ripple’s XRP fall from a morning high $0.39199 to a low $0.38820 before steadying. Ripple’s XRP left the major support and resistance levels untested early on. For the day ahead, a move through to $0.3940 levels would support a return to $0.40 levels. Ripple’s XRP would need the support of the broader market, however, to take a run at the first major resistance level at $0.4087. In the event of a broad-based crypto rebound, the 23.6% FIB of $0.4164 would likely limit any upside on the day. Failure to move through to $0.3940 levels could see Ripple’s XRP slide through the morning low to sub-$0.3850 levels. Barring an extended crypto sell-off, however, Ripple’s XRP should steer clear of the first major support level at $0.3769. Please let us know what you think in the comments below Thanks, Bob This article was originally posted on FX Empire",Bob Mason,FX Empire,2019-07-07T03:48:35.000Z
35," Facebook (FB) Mark Zuckerberg’s recent announcement of ambitious plans to launch a new, global cryptocurrency called Libra has been met with understandable alarm, particularly among regulators and consumer advocates. Much of the controversy has centered around antitrust issues, consumer privacy, and the ability of crooks to anonymously use the system for illicit purposes. Those are all legitimate concerns, but to my mind, the biggest risks are financial, both to users of Libra and the financial system as a whole. Those risks include the possibility of bank runs, credit disruptions, or consumer losses arising from foreign currency risks or financial mismanagement of the Libra reserve. The best way to understand these risks is to follow the money. Let’s start with the process of buying and redeeming Libra. Most cryptocurrencies, including the granddaddy of them all, Bitcoin, have failed to gain widespread acceptance as a method of payment because of their volatility. Zuckerberg hopes to avoid this problem by backing Libra with a reserve of stable world currencies, including the dollar, Euro, and Swiss franc. So you can buy Libra with pretty much any fiat currency — a U.S. dollar, Brazilian Real, Mongolian Tugrik, Indian Rupee — but the amount of Libra you receive will depend on the exchange rate between your currency and the basket of currencies in the reserve at the time of purchase. When you want to redeem your Libra back into your fiat currency, you may get more. But you may also get a lot less, particularly in developing countries with unstable currencies. It will depend on the exchange rate at the time of redemption. Let’s say you still want to buy this hip new digital coin, regardless of the foreign exchange risk. Where do you get the money? For citizens in the U.S. and other developed countries, the money will probably come from your bank account. It’s not going to hurt the banking system if you withdraw a few hundred a month for Libra transactions. But what if everyone decides they want to replace their bank accounts with Libra? After all, this would be a great way to avoid checking account fees. Retailers will love Libra as a way to avoid paying network fees on debit and credit card transactions. All of a sudden, that giant sucking sound is money coming out of the banks and into Libra’s kitty. You may think, “Fine. Let’s stick it to the banks. Look what they did to the economy in 2008.” But most of that money you withdraw from the banks is money they will no longer have to lend to the economy. So as Libra captures your cash, banks have less to make loans. With a run on the banks, we also get a credit contraction. Now Libra has your money (not the banks) and you have your digital coins. What will Libra do with your money? Libra’s white paper says your digital coin is safe because it will be backed by a basket of the most stable world currencies. But it’s not as if Libra will be purchasing paper money in each of these currencies and piling them in a bank vault. What this really means is that Libra will be taking your money and investing it in instruments denominated in those currencies. The return on these investments is how Facebook and other Libra founders will make money. Thus they will have incentives to invest in instruments that will maximize those returns, which may or may not maintain the stable value Libra’s founders are promising. The white paper promises to invest in low volatility assets such as bank deposits and short-term government securities, using “investment grade” financial institutions as custodians. (Reminder: Lehman Bros had an “A” rating from Standard and Poor’s before its collapse in 2008.) But there is no regulatory body to ensure that it does so, nor to require that Libra’s sponsors put up any of their own capital or reserves to backstop those investments if they go sour. In essence, Libra proposes the failed business model used by money market funds prior to the financial crisis. It wants you to buy Libra on the promise that the coin will maintain stable value, but there will be no regulatory oversight of what Libra actually does with your money and no capital and liquidity requirements that you would typically find with a bank. That structure proved disastrous during the 2008 crisis, when the Reserve Fund, a money market fund that heavily invested in Lehman Bros debt, “broke the buck” and prompted widespread runs on other money market funds. Even if Libra keeps its promise to put your money only in relatively safe bank deposits and government securities, we still have a problem. If the money comes out of banks (where it supports private sector lending) and goes into government securities, we would see a massive re-allocation of resources from the private to the public sectors. If you believe (as do I) that the market is generally a better allocator of economic resources than the government, this re-allocation will serve as a drag on economic growth. Libra says it will also put your money into bank deposits. Bank accounts have the advantage of maintaining stable value. Your bank account balance doesn’t fluctuate as would a securities investment. And perhaps this helps with our bank run problem. You take money out of your bank to buy Libra. Libra puts yours and other users’ money into other banks, which will presumably use it to make loans. But banks do fail, and depositors take losses on their uninsured deposits. So while Libra is saying it’s offering a better alternative to banks because it won’t be taking risk by lending out your money the way banks do, it will be putting at least some of your money right back into banks of its choosing. When you withdrew money from your bank to buy Libra, you probably had less than $250,000 in your account, meaning it was fully protected by the FDIC. But Libra’s founders hope to have a global reserve of hundreds of billions of dollars. Even if they spread the funds among multiple banks, at those levels, the lion’s share will likely be uninsured. Anyone who has followed my writings on blockchain knows that I’m enthusiastic about the use of distributed ledger technology to remove frictions in the payments system. So I don’t mean to sound too negative. The problem is, so long as cryptocurrencies have to rely on fiat currencies to maintain stable value, they will be exposed to the same kinds of risks embedded in the banking systems that support those currencies. I believe most of these risks can be addressed with thoughtful regulation. But before Mark Zuckenberg or anyone else tries to create his own global currency, we need to settle on an adequate regulatory framework to govern them. It would make sense for Congress to give the Federal Reserve Board lead authority for overseeing Libra, given its responsibility to conduct monetary policy and oversee an effective and efficient payments system. It is also an experienced financial supervisor, well-equipped to develop capital and liquidity requirements for Libra and other such ventures. In exercising that authority, the Fed could build on the pioneering work of the New York Department of Financial Services which currently regulates two trust companies which have successfully launched stable coins backed by the U.S. dollar. (Disclosure. I serve on the board of one of those trusts, Paxos.) Technology has the potential to dramatically change how the world pays for things in the future. Whether that transition is beneficial to consumers and businesses or financially disruptive will depend on whether regulators can stay ahead of this potentially rapid transformation. It’s open to question whether Mark Zuckerberg and Facebook are the right stewards for a new global cryptocurrency. But by firing this warning shot to government policy makers that such a change is coming and potentially coming soon, they have done a public service. Sheila Bair is the former Chair of the FDIC and has held senior appointments in both Republican and Democrat Administrations. She currently serves as a board member or advisor to a several companies and is a founding board member of the Volcker Alliance, a nonprofit established to rebuild trust in government. Read more: How regulators can stop leveraged lending from becoming the new subprime The $1.4 trillion student loan market faces a huge issue — transparency Former FDIC Chair: The Fed needs to hit pause on rate hikes America has left the door wide open for bailouts Vulnerability in America’s lower income brackets poses a risk to the economy China thinks long-term on financial stability — so should we Follow Yahoo Finance on Twitter, Facebook, Instagram, Flipboard, SmartNews, LinkedIn, YouTube, and reddit.",Sheila Bair,Yahoo Finance,2019-07-08T16:09:30.000Z
