title,article,author,provider,date
The Crypto Daily – The Movers and Shakers 04/07/19," Bitcoin led the way on Wednesday, providing much-needed support to the broader market at the turn of the quarter. Bitcoin rallied by 10.09% on Wednesday. Following on from a 2.29% gain from Tuesday, Bitcoin ended the day at $11,982. A bullish start to the day saw Bitcoin rally from an intraday low $10,876 to a mid-morning high $11,584. Bitcoin broke through the 23.6% FIB of $11,275 and first major resistance level at $11,323.93 before hitting reverse. Bitcoin fell back through the 23.6% FIB to sub-$11,000 levels before bouncing back to $11,500 levels. A relatively choppy afternoon saw Bitcoin find support at the 23.6% FIB of $11,275 before a late in the day rally. The late rally saw Bitcoin rise from an afternoon low $11,038 to a late intraday high $12,025. Bitcoin broke through the 23.6% FIB, first major resistance level at $11,323.93 and second major resistance level at $11,762.87. Across the rest of the top 10 cryptos, it was a sea of green across the crypto-board. Coming in a distant second to Bitcoin was Ethereum, which gained 3.62%. Bitcoin Cash SV (+3.03%), Litecoin (+2.69%), EOS (+2.39%), Bitcoin Cash ABC (+2.25%), Tron (+2.14%) and Binance Coin (+2.10%) also made solid gains on the day. For Stellar’s Lumen, a modest 1.52% gain on the day saw the gap widen with Tron sitting at the number 10 spot by market cap. The Bitcoin rally on the day led to Bitcoin’s dominance rising back to 62% levels. At the time of writing, Bitcoin’s dominance stood at 63.1% The total crypto market cap rose from $315bn levels to $337.4bn on Wednesday, supported by Bitcoin’s break out. At the time of writing, Bitcoin was down by 1.08% to $11,852. A mixed start to the day saw Bitcoin rise to a morning high $12,065 before falling to a morning low $11,808. Bitcoin left the major resistance and support levels untested in the early hours. Elsewhere, Binance Coin bucked the trend at the time of writing, rising by 0.31%. For the rest of the pack, it was back in the red. Leading the way was EOS, which was down by 2.25%. Litecoin (-1.38%), Ethereum (-1.26%) and Tron (-1.21%) were also deep in the red in the early hours. Amongst the cryptos in reverse, Bitcoin Cash SV saw the most modest loss, down by 0.02% at the time of writing. Bitcoin would need to hold onto $11,800 levels through the morning to support a rebound later in the day. A move through the morning high $12,065 would bring the first major resistance level at $12,379.33 into play. Bitcoin would need the support of the broader market, however, to break out from the morning high. Failure to hold onto $11,800 levels could see Bitcoin cough up Wednesday’s gains. A fall through to sub-$11,630 levels would bring the 23.6% FIB of $11,275 into play. Barring a crypto meltdown, the first major support level at $11,230.33 should limit any downside in the event of an extended sell-off. Get Into Cryptocurrency Trading Today This article was originally posted on FX Empire",Bob Mason,FX Empire,2019-07-04T04:37:02.000Z
Bitcoin Tech Analysis – Recap and Mid-Day Review – 04/07/19," Bitcoin rallied by 10.09% on Wednesday. Following on from a 2.29% gain on Tuesday, Bitcoin ended the day at $11,983. A bullish start to the day set the tone, with Bitcoin on the move from the start of the day. Bitcoin rallied from an intraday low $10,876 to a mid-morning high $11,584. The moves through the early hours saw Bitcoin break through the 23.6% FIB of $11,275 and the first major resistance level at $11,762.87. A pullback to sub-$11,000 levels by late morning saw Bitcoin steer clear of the first major support level at $10,087.13 before a late rally. The late rally saw Bitcoin break back through the 23.6% FIB of $11,275, first major resistance level at $11,323.93, and second major resistance level at $11,762.87 to hit an intraday high $12,025. Resistance at $12,000 limited the upside on the day. The Bitcoin rally led to Bitcoin’s dominance rising back to 62% levels. Bitcoin’s market cap jumped to a Wednesday high $213.5bn before easing back. Bitcoin ultimately provided support to the broader crypto market, leading the majors into positive territory on the day. For the Bitcoin bulls, the near-term bullish trend, formed at mid-December’s swing lo $3,215.2 remained intact. Bitcoin continued to find support at the 23.6% FIB of $11,275. Wednesday’s rally was another day of correlation with the more mature markets. The rally kicked in well ahead of economic data out of the U.S, however. Weak U.S stats continued to support the FED’s projected rate cut later in the day year. While the cheaper cost of funds is a boon for riskier assets, the current interest rate environment continues to be supportive. A negative for Bitcoin and the broader market continues to be the prospect of a material shift in the regulatory landscape. There’s also the pending SEC decisions on the Bitcoin ETFs to consider. The recent volatility across the broader market has come at the wrong time for those hoping for Bitcoin ETFs to be approved. The good news, however, is the fact that there have been no headline cases of exchanges being hacked… Another piece of good news is the fact that the planned launch of Facebook’s Libra has done no damage just yet… At the time of writing, Bitcoin was down by 1.63% to $11,787. In the early part of the day, Bitcoin rose to a start of a day high $12,065 before hitting reverse. Falling short of the first major resistance level at $12,379.33, Bitcoin fell back to a late morning low $11,503. Steering clear of the 23.6% FIB of $11,275 and first major support level at $11,230.33, Bitcoin moved back through to $11,700 levels. For the Bitcoin bulls, $12,000 looks to be the line in the sand. A hold onto $11,700 levels through the early afternoon would support a move back through to $11,900 levels. Bitcoin would need the support of the broader market, however, to break out from this morning’s high $12,065. In the event of a breakout, the first major resistance level at $12,379.33 would come into play before any pullback. Failure to hold onto $11,700 levels could see Bitcoin slide back through the 23.6% FIB of $11,275. Barring an extended sell-off through the afternoon, the first major support level at $11,230.33 should limit the downside. In the event of a sell-off, expect a return to sub-$11,000 levels before finding support. The article was written by Bharat Gohri, Chief Market Analyst at easyMarkets This article was originally posted on FX Empire",Bharat Gohri,FX Empire,2019-07-04T13:35:45.000Z
"Bitcoin Cash – ABC, Litecoin and Ripple Daily Analysis – 03/07/19"," Bitcoin Cash ABC fell by 2.59% on Tuesday. Partially reversing a 4.11% gain from Monday, Bitcoin Cash ABC ended the day at $408.02. A bearish start to the day saw Bitcoin Cash ABC fall from an early intraday high $418.87 to a late morning intraday low $383.16. Falling well short of the major resistance levels, Bitcoin Cash ABC fell through the 23.6% FIB of $418 and the first major support level at $394.38. Finding support through the afternoon, Bitcoin Cash ABC recovered to $400 levels to limit the loss on the day. In spite of the partial recovery, Bitcoin Cash ABC was unable to move back through the 23.6% FIB… At the time of writing, Bitcoin Cash ABC was up by 1.1% to $412.50. A bullish start to the day saw Bitcoin Cash ABC rise from a morning low $408.41 to a high $418.0. Whilst falling short of the first major resistance level at $423.54, the 23.6% FIB of $418 continued to limit progress. For the day ahead, Bitcoin Cash ABC would need to steer clear of sub-$410 levels to support another run at the first major resistance level at $423.54. Bitcoin Cash ABC would need the support of the broader market, however, to break out from the 23.6% FIB of $418. An extended crypto rally through the day could see Bitcoin Cash ABC test the second major resistance level at $439.06. Failure to avoid sub-$410 levels could see Bitcoin Cash ABC slide back through to sub-$400 levels. Barring a broad-based crypto sell-off, the first major support level at $387.87 should limit any downside on the day. Litecoin slid by 3.26% on Tuesday. Reversing a 0.42% gain from Monday with interest, Litecoin ended the day at $118.59. A particularly bearish morning saw Litecoin slide from an intraday high $123.41 to a mid-morning intraday low $111.2. The reversal saw Litecoin slide through the 23.6% FIB of $117 and the first major support level at $114.94. Finding support through the afternoon, Litecoin managed a brief return to $120 levels before easing back. The 23.6% FIB proved to be the resistance line on the day. At the time of writing, Litecoin was up by 1.63% to $120.52. A bullish start to the day saw Litecoin rise from a morning low $118.54 to a high $123.16 before easing back. Litecoin left the major support and resistance levels untested and also held above the 23.6% FIB of $117. For the day ahead, a hold above the 23.6% FIB of $117 through the morning would support a bullish day ahead. A move back through the morning high $123.16 would bring the first major resistance level at $124.27 into play. Barring a broad-based crypto rally, Litecoin would likely see any upside capped at $126 levels on the day. Failure to hold above the 23.6% FIB of $117 could see Litecoin test the first major support level at $112.06 before any recovery. Barring a crypto sell-off later in the day, Litecoin should steer clear of sub-$110 support levels on the day. Ripple’s XRP fell by 1.98% on Tuesday. Partially reversing a 3.4% gain from Monday, Ripple’s XRP ended the day at $0.39991. Tracking the broader market, Ripple’s XRP fell from an early intraday high $0.41187 to a late morning intraday low $0.38414. Falling well short of the major resistance levels, Ripple’s XRP fell through the first major support level at $0.3922. Recovery through the afternoon saw Ripple’s XRP return to $0.4040 levels before sliding back to sub-$0.40 levels. At the time of writing, Ripple’s XRP was up by 0.74% to $0.40288. Tracking the broader market, Ripple’s XRP rose from a morning low $0.39989 to a high $0.40711 before easing back. Ripple’s XRP left the major support and resistance levels untested early on and also fell short of the 23.6% FIB of $0.4164. For the day ahead, a hold onto $0.40 levels through the morning would support further gains later in the day. A move back through the morning high $0.40711 would bring the first major resistance level at $0.4131 into play. Ripple’s XRP would need the support of the broader market, however, to break through the 23.6 % FIB of $0.4164. Barring a broad-based crypto rally, Ripple’s XRP would likely come up short of $0.42 levels on the day. Failure to move back through the morning high $0.40711 could see Ripple’s XRP hit reverse. A fall through to sub-$0.40 levels would bring the first major support level at $0.3854 into play before any recovery. Barring a crypto meltdown, Ripple’s XRP should steer clear of sub-$0.38 support levels on the day. Please let us know what you think in the comments below Thanks, Bob This article was originally posted on FX Empire",Bob Mason,FX Empire,2019-07-03T03:16:41.000Z
Making this easy to understand isn’t easy," Having recently read an article on the BBC website purporting to try and explain the importance of blockchain to the world’s economy, I was struck by the intellectual muddiness of these waters and how easy it is to confuse blockchain with Bitcoin, and Bitcoin with altcoins. It really is no wonder that the “man on the street” doesn’t understand these things, and consequently these misconceptions have become a real barrier to mainstream adoption. At the heart of blockchain, it really isn’t much more than a ledger or database (dependent on which descriptor you prefer). A blockchain database is unique, however, through its three pillars of being distributed (multiple copies of), being decentralised (no one copy has version control), and immutable (each transaction recorded is unchangeable). Bitcoin was the first blockchain, and as such is frequently referred to when trying to explain or understand blockchain. What the Bitcoin protocol (the underlying rules of the blockchain) solved technically was the double spend problem. This was key to creating a digital cash that was unforgeable. It’s easy to go too far down the rabbit hole on Bitcoin and start looking at the economic programming and proof-of-work (PoW) consensus mechanism that makes Bitcoin so attractive to investors, but this takes us away from understanding blockchain. In order to offer a simple explanation of the difference between blockchain technology and cryptocurrency, it’s best to use the analogy of the internet and email. Email, it’s widely agreed, was the internet’s first killer app – so email is simply an application built on top of the internet, but the internet offers far more than just email. Similarly, Bitcoin was blockchain’s first killer app, and as such, all cryptocurrency is built on top of a blockchain – but blockchain can do so much more than just cryptocurrency. With blockchain working as a shared ledger and acting as a trusted central source of truth, we can see organisations looking to solve such complex topics as digital identity (Sovrin), supply chain digital transformation (Tradelens), food provenance (IBM Food Trust), and efficiency in the transportation and logistic industry (BITA). Under the cloak of darkness, many companies are aiming to create proof of concepts that can deliver real-world results for their various industries. In time, the cloak will be lifted and we will see which ones have succeeded and, hopefully, which ones have failed and we can learn from. The Bitcoin protocol is slow, but this is not the protocol that would be used in enterprise environments. The Bitcoin protocol is energy hungry (through PoW), but enterprise blockchains would not use PoW as its consensus mechanism. If you’re looking at having a digital form of money, it makes sense that there should be a cost to creating it in the form of energy consumption. If you’re aiming to clean up the luxury goods markets from fakes and rip-offs, a consortia of luxury goods manufacturers and retailers using proof of authority makes sense – it really is a case of horses for courses. The article also discusses the value that many intermediaries have, and this isn’t wrong. There are plenty of middlemen that actually add value to our every day lives, including the basic function of banking to be the trusted custodian of our money. However, there are also plenty of things that commercial banks do that do not add value, and we should take back sovereignty over – international transfers of money for one. Centralised third-party middlemen are not the problem, the degree to which we can trust them to act on our behalf is. The BBC article misunderstands a basic precept about Bitcoin regarding the speed of transactions by comparing it to Mastercard and Visa. A better comparison for Bitcoin is gold, where transaction in the metal takes a long time and costs a lot of money as it’s generally done as a settlement layer at central bank level. One day in the future, I, and many others believe that Bitcoin will be able to be used as simply as Mastercard or Visa is today, but that requires a layer two solution (such as Lightning), and a much more significant market cap that would be in the trillions of dollars. We may be some way from that being a reality at the present time, but that is just a reason why we should make the effort to understand these issues today. The article jumps to talking about problems with other blockchain based currencies, known as altcoins, but without creating a clear distinction from Bitcoin and creating the clarification that there is no “the blockchain”, but actually many different flavours of the same concept. Many of the altcoins, are based upon a token that drives actions on top of the matching blockchain. For example, Ethereum was a new protocol that went live in 2015 and was intended to be a decentralised global computer with the ability to execute smart contracts. Ether was the token created both as a way to raise the initial funds to build the technology and is now the gas that powers it. Ethereum also paved the way for a glut of new tokens created by entrepreneurs (and scammers) on top of the Ethereum protocol, most of which only had a utility within the application built on top of it. Many people have tried to create new cryptocurrencies, some through forks of pre-existing protocols and coins (such as Bitcoin), and some as entirely new protocols. For some of the entrepreneurs that went down this road, it was little more than a way of making themselves rich. However the main problem with the altcoins when trying to be viewed as money, is that they tend to be overly centralised (meaning that the transactions and rules of the currency won’t have as much trust), and look to reduce energy consumption and speed up transaction throughput through different consensus mechanisms such as proof-of-stake (PoS) or delegated PoS, and tend to lack scarcity – if you understand economics, it’s fairly easy to see that without significant cost and scarcity, there can be no significant value created with respect to money. Again, look at the comparison to finding and excavating gold from the earth. My belief is that in ten years’ time, Bitcoin will have either changed the world we live in or will have become virtually valueless. Conversely, I believe that blockchain is here to stay and will change the world but needs to fade into the background. The reality is that blockchain is still mostly hype, as was the internet in 1994. The industry needs time to develop – just because it’s hype today, it doesn’t mean that there isn’t real world-changing tech there. Jon Walsh, Associate Partner Blockchain Rookies @walshjonwalsh   The post Making this easy to understand isn’t easy appeared first on Coin Rivet.",Jon Walsh,Coin Rivet,2019-07-04T17:00:46.000Z
Bitcoin’s hash rate hits all-time high," Bitcoin's hash rate has reached its all-time high according to data from Blockchain.com. As of July 5, 2019, Bitcoin's hash rate broke 74.5 million tera hashes per second — up 109% year-over-year. Bitcoin's previous all-time high hash rate was reached on June 29, 2019, at 68.6 million tera hashes per second.",Steven Zheng,The Block,2019-07-07T02:05:58.000Z
"Bitcoin Cash – ABC, Litecoin and Ripple Daily Analysis – 06/07/19"," Bitcoin Cash ABC rose by 0.46% on Friday. Partially reversing a 5% slide from Thursday, Bitcoin Cash ABC ended the day at $400.0. A choppy day saw Bitcoin Cash ABC slide to a mid-morning intraday low $393.06 before finding support. Steering clear of the first major support level at $390.63, Bitcoin Cash ABC rallied to a late morning intraday high $411.50. In spite of the upswing, Bitcoin Cash ABC fell short of the first major resistance level at $413.25 and 23.6% FIB of $418. Easing back through the afternoon, Bitcoin Cash ABC slid back to $396 levels before a late recovery to $400 levels. At the time of writing, Bitcoin Cash ABC was up by 1.13% to $404.5. A bullish start to the day saw Bitcoin Cash ABC rise from a morning low $400.67 to a high $404.5. Bitcoin Cash ABC left the major support and resistance levels untested early on. For the day ahead, a hold above $401.5 would support a run at the first major resistance level at $409.98. Bitcoin Cash ABC would need the continued support of the broader market, however, to take a run on Thursday’s high $411.5. Barring a broad-based crypto rally, Bitcoin Cash ABC would likely fall short of recovery through the 23.6% FIB of $418.0. Failure to hold above $401.5 could see Bitcoin Cash ABC test the first major support level at $391.54. Barring a crypto meltdown, Bitcoin Cash ABC should steer clear of sub-$390 support levels on the day. Litecoin fell by 0.79% on Friday. Following on from a 1.8% fall from Thursday, Litecoin ended the day at $118.54. A choppy morning saw Litecoin fall to a low $116.88 before striking a late morning intraday high $120.85. The early pullback saw Litecoin fall through the 23.6% FIB of $117 to come within range of the first major support level at $116.62. In spite of rebound, Litecoin fell short of the first major resistance level at $124.96. Pulling back through the afternoon, Litecoin fell back through the 23.6% FIB to an intraday low $116.56. Litecoin tested the first major support level at $116.62 for a 2nd time on the day before a recovering to $119 levels. A late pullback saw Litecoin fall back into the red for the day. At the time of writing, Litecoin was up 1.28% to $120.06. Tracking the broader market, Litecoin rose from a morning low $118.41 to a high $120.79 before easing back. Steering clear of the major support levels, the first major resistance level at $120.74 pinned Litecoin back early on. For the day ahead, a hold above $118 levels would support another move through the first major resistance level at $120.74. Litecoin would need support from the broader market, however, to take a run at the second major resistance level at $122.94. Barring a broad-based crypto rally, Thursday’s high $120.85 and the first major resistance level would likely limit any upside. Failure to hold above $118 levels could see Litecoin fall through the 23.6% FIB of $117. The first major support level at $116.45 would likely limit any downside. Ripple’s XRP fell by 2.15% on Friday. Following on from a 4.47% slide from Thursday, Ripple’s XRP ended the day at $0.37948. A bearish start to the day saw Ripple’s XRP slide from an intraday high $0.38920 to a mid-morning intraday low $0.37405. The reversal saw Ripple’s XRP fall through the first major support level at $0.3802. Ripple’s XRP managed to recover to $0.385 levels by late morning before easing back through the 2nd half of the day to sub-$0.38 levels. At the time of writing, Ripple’s XRP was up by 1.34% to $0.38457. A bullish start to the day saw Ripple’s XRP rise from a morning low $0.37936 to a high $0.38612 before easing back. Ripple’s XRP left the major support and resistance levels untested early on. For the day ahead, a hold above $0.3810 levels would support further upside on the day. Ripple’s XRP would need the support of the broader market, however, to break through the first major resistance level at $0.3878. Barring a broad-based crypto rally, Thursday’s high $0.3892 and first major resistance level would likely cap any upside. Failure to hold above $0.3810 levels could see Ripple’s XRP test the first major support level at $0.3726 before any recovery. Barring a broad-based crypto sell-off, Ripple’s XRP will likely steer clear of sub-$0.37 levels on the day. Please let us know what you think in the comments below Thanks, Bob This article was originally posted on FX Empire",Bob Mason,FX Empire,2019-07-06T01:22:40.000Z
