title,article,author,provider,date
Singapore government proposes to exempt value-added tax on cryptocurrencies," The government of Singapore is planning to end goods and services tax (GST) (or value-added tax (VAT) as known in some countries) on cryptocurrencies that function or are intended to function as a medium of exchange.  The Inland Revenue Authority of Singapore (IRAS) published draft GST guidelines on Friday, stating that the supply of “digital payment tokens” in exchange for fiat currency or other digital payment tokens will be exempt from GST. Therefore, the supply of such tokens, being an exempt supply, “will not contribute to your annual taxable turnover for the determination of your liability for GST registration.” The proposal, if passes legislation, will become effective from January 1, 2020. The IRAS is currently seeking comments from cryptocurrency businesses, and they need to respond by July 26. The IRAS has defined digital payment tokens as having the following characteristics: “(a) it is expressed as a unit; (b) it is fungible; (c) it is not denominated in any currency, and is not pegged by its issuer to any currency; and (d) it is, or is intended to be, a medium of exchange accepted by the public, without any substantial restrictions on its uses as consideration.”  Bitcoin (BTC), ether (ETH), litecoin (LTC), dash (DASH), monero (XMR), Zcash (ZEC) and XRP are examples of digital payment tokens, the IRAS said. Notably, stablecoins do not qualify as digital payment tokens as per the definition by the authority. “A digital token pegged to US dollars will not qualify as a digital payment token but may instead fall under the list of financial services,” it said.",Yogita Khatri,The Block,2019-07-08T07:12:34.000Z
," Count this as the latest attempt by a cryptocurrency exchange to take a piece of the perpetual swap pie. IDG-backed KuCoin has announced the beta launch of its derivatives trading platform, KuMEX. To start, the new platform will offer trading of its so-called Bitcoin Perpetual Contract (XBTUSDM).  KuCoin is the latest cryptocurrency exchange to announce its intention to gatecrash the market for cryptocurrency derivatives, a space currently dominated by behemoth BitMEX. Houbi, Binance, and Bitfinex have recently launched or announced the impending launch of their own platforms to trade perpetual swaps, a synthetic way to bet on cryptocurrencies.  As part of its attempt to lure traders to the new venue, KuMEX will offer rebates to certain traders. “At the same time, KuMEX offers a negative fee for Makers at a rate of -0.025% with a certain amount of fixed commission, encouraging users to provide liquidity to the platform through making the market and earning some commission as an incentive,” the press release reads. Furthermore, the platform uses Bitcoin Spot Index that volume-weights the price of bitcoin in six major exchanges—Coinbase Pro, Bitstamp, Kraken, Gemini, Liquid and Bittrex. According to the press release, by using figures from more exchanges, KuMEX hopes to achieve a more “fair and rigorous” bitcoin index price. Meanwhile, rival BitMEX prices its swaps based on data from a pool of three exchanges.  KuCoin also announced a trading competition, with a reward of 10,000 KCS for users with top scores in their return rate ranking.",Carol Gaszcz,The Block,2019-07-08T14:47:12.000Z
1," At the time of writing, Bitcoin (BTC) is trading just above $11,450 after price crashed close to 23% from $13,800 to $10,500 during the previous week. It seems the hypothesis that weekends are good for Bitcoin may not always be true, even though the price is now higher than it was one week ago as BTC consolidated above the key $11,000 level on Sunday. Will Bitcoin push higher during the week? Or will we see more major retracements back to the $10,000 region? Bitcoin is evolving as expected. Its overall value keeps increasing, and if you look at the volumes profile on the left of the graph above, you’ll notice there’s plenty of volume keeping BTC above the critical $11,000 level. My prediction that Bitcoin could hit $20,000 by the end of the year could turn into an “end of the month” kind of deal. Assuming the positive trend continues and BTC price continues to rise, we should expect higher volumes coming in at key levels close to $20,000. Although many retail investors will be looking to sell some of their gains when Bitcoin hits all-time highs again, we can expect the price to keep going at least for a few weeks. However, as the market becomes more liquid, we should expect fewer violent swings, so it could take longer for BTC to reach a new high. Let’s not forget that I consider Bitcoin to be in a bull run when the 20-day EMA is above the 50-day EMA and the latter is above the 200-day EMA. As we’ve already accomplished that goal – not only in shorter time frames but also in daily and weekly ones as well – I personally think the bears have retreated and bulls are now firmly in charge. Volume also seems to be increasing as well. Over the past two weeks, volume has gone from $17 billion to $23 billion, consolidating now around $20 billion. Putting all this information together, we’re now clearly on the right path to reach $15,000 – or maybe even $20,000 – by the end of 2019. Of course, if you think I might be overreacting to positive news, you can always check what other expert analysts have to say about this recent price movement. Hopefully, the market will continue this positive momentum. Pay attention to retracements back down towards the 200-day EMA to make new entries. Safe trades! Current live Bitcoin pricing information and interactive charts are available on our site 24 hours a day. The ticker bar at the bottom of every page on our site has the latest Bitcoin price. Pricing is also available in a range of different currency equivalents: US Dollar – BTCtoUSD British Pound Sterling – BTCtoGBP Japanese Yen – BTCtoJPY Euro – BTCtoEUR Australian Dollar – BTCtoAUD Russian Rouble – BTCtoRUB In August 2008, the domain name bitcoin.org was registered. On 31st October 2008, a paper was published called “Bitcoin: A Peer-to-Peer Electronic Cash System”. This was authored by Satoshi Nakamoto, the inventor of Bitcoin. To date, no one knows who this person, or people, are. The paper outlined a method of using a P2P network for electronic transactions without “relying on trust”. On 3rd January 2009, the Bitcoin network came into existence. Nakamoto mined block number “0” (or the “genesis block”), which had a reward of 50 Bitcoins. If you want to find out more information about Bitcoin or cryptocurrencies in general, then use the search box at the top of this page. Here’s an article to get you started. As with any investment, it pays to do some homework before you part with your money. The prices of cryptocurrencies are volatile and go up and down quickly. This page is not recommending a particular currency or whether you should invest or not. *The views and opinions expressed by the author should not be considered financial advisement. The author is not a professional trader, nor investor.  The post Latest Bitcoin price and analysis (BTC to USD) appeared first on Coin Rivet.",Pedro Febrero,Coin Rivet,2019-07-08T10:00:45.000Z
The Crypto Daily – The Movers and Shakers 08/07/19," Bitcoin closed out the week in positive territory, resuming what has been a particularly bullish run since January. Year-to-date Bitcoin has seen just 8 weekly losses, 2 of which came in June. On Sunday, Bitcoin rose by 1.85%, following on from a 2.56% gain on Saturday, to end the day at $11,485. It was a relatively range-bound first half of the day. Bitcoin eased back to a mid-morning intraday low $11,110 before recovering to a late morning high $11,375. The late morning rally saw Bitcoin break through the 23.6% FIB of $11,275 that provided much-needed support through the morning. Falling back from $11,400 levels struck in the middle of the day, Bitcoin slipped through the 23.6% FIB to $11,150 levels before finding support. Bitcoin bounced back to a late intraday high $11,620 before easing back. In spite of the afternoon rally, Bitcoin came up short of the first major resistance level at $11,680.33. For the week, the weekend gains delivered a 6.34% rise for the week ending 7th July. Across the rest of the top 10 cryptos, it was green across the board for majors on Sunday. Leading the way on the day were Tron’s TRX and Ethereum, which saw gains of 8.94% and 6.52% respectively. EOS also outperformed Bitcoin on the day, rising by 3.28%. The rest of the pack saw more modest gains. Bitcoin Cash ABC (+1.79%), Ripple’s XRP (+1.81%), Binance Coin (+1.91%), and Bitcoin Cash SV (+1.96%) stood alongside Bitcoin on the day. Litecoin saw the most modest gain of the day, however, rising by 1.71%. For the week, Tron’s TRX led the way, rallying by 10.06% to cement its position in the number 10 spot by market cap. Bucking the trend in the week was Litecoin, which fell by 1.52%. Bitcoin’s dominance held onto 62% levels, having peaked at 63% levels on Thursday. At the time of writing, Bitcoin’s dominance stood at 62.1%. The total crypto market cap rose from $313.57bn to a high $337.76bn on Thursday before easing back to $330bn levels. At the time of writing, Bitcoin was down by 0.39% to $11,440. Moves at the start of the day saw Bitcoin fall from a morning high $11,547 to a low $11,413. Bitcoin steered clear of the major support and resistance levels early on. Elsewhere, Bitcoin Cash ABC and Tron’s TRX bucked the trend early, rising by 0.49% and by 0.29% respectively. The rest of the pack were in the red, with Bitcoin Cash SV leading the way down with a 1.47% loss. Bitcoin would need to hold onto $11,400 levels to make a move later in the day. A move through the morning high to $11,600 levels would bring the first major resistance level at $11,700 into play. Barring a broad-based crypto rally, Sunday’s high $11,620 and the first major resistance level will likely limit any upside. Failure to hold onto $11,400 levels could see Bitcoin slide through the 23.6% FIB of $11,275. A pullback to $11,200 levels would bring the first major support level at $11,190 into play before any recovery. Barring a crypto meltdown, Bitcoin should steer clear of sub-$11,000 support levels on the day. Get Into Cryptocurrency Trading Today This article was originally posted on FX Empire",Bob Mason,FX Empire,2019-07-08T00:48:33.000Z
Latest Bitcoin price and analysis (BTC to USD)," At the time of writing, Bitcoin (BTC) is trading just above $11,450 after price crashed close to 23% from $13,800 to $10,500 during the previous week. It seems the hypothesis that weekends are good for Bitcoin may not always be true, even though the price is now higher than it was one week ago as BTC consolidated above the key $11,000 level on Sunday. Will Bitcoin push higher during the week? Or will we see more major retracements back to the $10,000 region? Bitcoin is evolving as expected. Its overall value keeps increasing, and if you look at the volumes profile on the left of the graph above, you’ll notice there’s plenty of volume keeping BTC above the critical $11,000 level. My prediction that Bitcoin could hit $20,000 by the end of the year could turn into an “end of the month” kind of deal. Assuming the positive trend continues and BTC price continues to rise, we should expect higher volumes coming in at key levels close to $20,000. Although many retail investors will be looking to sell some of their gains when Bitcoin hits all-time highs again, we can expect the price to keep going at least for a few weeks. However, as the market becomes more liquid, we should expect fewer violent swings, so it could take longer for BTC to reach a new high. Let’s not forget that I consider Bitcoin to be in a bull run when the 20-day EMA is above the 50-day EMA and the latter is above the 200-day EMA. As we’ve already accomplished that goal – not only in shorter time frames but also in daily and weekly ones as well – I personally think the bears have retreated and bulls are now firmly in charge. Volume also seems to be increasing as well. Over the past two weeks, volume has gone from $17 billion to $23 billion, consolidating now around $20 billion. Putting all this information together, we’re now clearly on the right path to reach $15,000 – or maybe even $20,000 – by the end of 2019. Of course, if you think I might be overreacting to positive news, you can always check what other expert analysts have to say about this recent price movement. Hopefully, the market will continue this positive momentum. Pay attention to retracements back down towards the 200-day EMA to make new entries. Safe trades! Current live Bitcoin pricing information and interactive charts are available on our site 24 hours a day. The ticker bar at the bottom of every page on our site has the latest Bitcoin price. Pricing is also available in a range of different currency equivalents: US Dollar – BTCtoUSD British Pound Sterling – BTCtoGBP Japanese Yen – BTCtoJPY Euro – BTCtoEUR Australian Dollar – BTCtoAUD Russian Rouble – BTCtoRUB In August 2008, the domain name bitcoin.org was registered. On 31st October 2008, a paper was published called “Bitcoin: A Peer-to-Peer Electronic Cash System”. This was authored by Satoshi Nakamoto, the inventor of Bitcoin. To date, no one knows who this person, or people, are. The paper outlined a method of using a P2P network for electronic transactions without “relying on trust”. On 3rd January 2009, the Bitcoin network came into existence. Nakamoto mined block number “0” (or the “genesis block”), which had a reward of 50 Bitcoins. If you want to find out more information about Bitcoin or cryptocurrencies in general, then use the search box at the top of this page. Here’s an article to get you started. As with any investment, it pays to do some homework before you part with your money. The prices of cryptocurrencies are volatile and go up and down quickly. This page is not recommending a particular currency or whether you should invest or not. *The views and opinions expressed by the author should not be considered financial advisement. The author is not a professional trader, nor investor.  The post Latest Bitcoin price and analysis (BTC to USD) appeared first on Coin Rivet.",Pedro Febrero,Coin Rivet,2019-07-08T10:00:45.000Z
," Bitcoin Cash ABC rose by 1.59% on Saturday. Following on from a 0.46% gain from Friday, Bitcoin Cash ABC ended the day at $407.05. A mixed start to the day saw Bitcoin Cash ABC rise from an intraday low $400.67 to a morning high $406.43 before easing back to $401 levels. Steering clear of the major support and resistance levels, Bitcoin Cash ABC rallied to a late afternoon intraday high $416.8. Bitcoin Cash ABC broke through the first major resistance level at $409.98. Falling short of the 23.6% FIB of $418, Bitcoin Cash ABC pulled back to sub-$410 levels late in the day. At the time of writing, Bitcoin Cash ABC was down by 1.15% to a morning low $402.37. A mixed start to the day saw Bitcoin Cash ABC rise to a morning high $406.63 before falling into the red. Bitcoin Cash ABC left the major support and resistance levels untested early on. For the day ahead, a move through to $408 levels would support a run at the first major resistance level at $415.68. Barring a broad-based crypto rally, the first major resistance level and Saturday’s high $416.8 would cap any upside on the day. Failure to move through to $408 levels could see Bitcoin Cash ABC fall deeper into the red. A fall through the first major support level at $399.55 would bring the second major support level at $392.04 into play. Barring a crypto meltdown, Bitcoin Cash ABC should steer clear of sub-$390 levels. Litecoin slipped by 0.18% on Saturday. Following on from a 0.79% fall from Friday, Litecoin ended the day at $118.25. A bullish start to the day saw Litecoin hit a morning high $120.91. Coming up against the first major resistance level at $120.74 Litecoin pulled back to a morning low $118.18. Steering clear of the 23.6% FIB of $117 and first major support level at $116.27, Litecoin rallied to a late afternoon intraday high $122.29. Litecoin broke back through the first major resistance level at $120.74 before sliding to a late intraday low $117.3. Finding support at the 23.6% FIB of $117, Litecoin recovered to $118 levels to limit the downside on the day. At the time of writing, Litecoin was down by 0.18% to $118.04. A choppy start to the day saw Litecoin rise from a morning low $117.43 to a high $119.14 before easing back. Litecoin left the major support and resistance levels untested early on. For the day ahead, a move back through the morning high to $119.30 levels would support a run at the first major resistance level at $121.26. Litecoin would need the support of the broader market, however, to break clear of $120. Barring a broad-based crypto rally, Saturday’s high $122.29 should limit the upside on the day. Failure to move through to $119.30 levels could see Litecoin slide back to $117 levels. In the event of an extended sell-off, Litecoin could fall through the 23.6% FIB of $117 to test the first major support level at $116.37 before any recovery. Ripple’s XRP rallied by 3.08% on Saturday. Reversing a 2.15% fall from Friday, Ripple’s XRP ended the day at $0.39155. Tracking the broader market, Ripple’s XRP rose from an intraday low $0.37936 to a morning high $0.38738. Ripple’s XRP came within range the first major resistance level at $0.3878 before easing back to $0.381 levels. An early afternoon rally saw Ripple’s XRP strike an intraday high $0.41113 before sliding back to sub-$0.39 levels. The rally saw Ripple’s XRP break through the first major resistance level at $0.3878 and second major resistance level at $0.3061. Ripple’s XRP came up against the third major resistance level at $0.4112 before the reversal. At the time of writing, Ripple’s XRP was down by 0.6% to $0.38921. A bearish start to the day saw Ripple’s XRP fall from a morning high $0.39199 to a low $0.38820 before steadying. Ripple’s XRP left the major support and resistance levels untested early on. For the day ahead, a move through to $0.3940 levels would support a return to $0.40 levels. Ripple’s XRP would need the support of the broader market, however, to take a run at the first major resistance level at $0.4087. In the event of a broad-based crypto rebound, the 23.6% FIB of $0.4164 would likely limit any upside on the day. Failure to move through to $0.3940 levels could see Ripple’s XRP slide through the morning low to sub-$0.3850 levels. Barring an extended crypto sell-off, however, Ripple’s XRP should steer clear of the first major support level at $0.3769. Please let us know what you think in the comments below Thanks, Bob This article was originally posted on FX Empire",Bob Mason,FX Empire,2019-07-07T03:48:35.000Z
"SEC seeks blockchain data provider to monitor risk, improve compliance, and inform policy"," The U.S. Securities and Exchange Commission (SEC) is getting ever more serious about blockchain data. While many of the world's governments and politicians focus on Facebook's recently introduced Libra and data sharing among virtual asset providers, the SEC is seeking more data on public blockchains. The requirements listed by the SEC specific that all data is sourced from hosted notes rather than blockchain explorers. The Bitcoin and Ethereum blockchains are mandatory, while Bitcoin Cash, Stellar, Zcash, EOS, NEO and XRP data are all specified as desirable. In addition, as new blockchains gain increased prominence, the SEC would require support for them. The SEC is seeking full blockchain data from the genesis block or inception and information about any derivative currencies (tokens) affiliated with these blockchains. The required data format is very specific with normalized fields for each included blockchain sourced from on-node data, in its entirety. The minimum fields specified are ticker symbol; send and receive addresses; transaction hash, timestamp and amounts; unspent send and receive balances; transaction fees; confirmations; block hash; and block height. If possible, the SEC also seeks further metadata and chain metrics such as hashing algorithms, hashing power, mining difficulty and rewards, transactions quantity and size, coin supply and blockchain size. The data is expected to be provided directly by the vendor's own node for each blockchain using a secure, encrypted data feed; synced with the network; and run in a secure, controlled environment. The data must also be presented with means to validate its accuracy and completeness and meet the requirements of financial statement audit testing. The contract length will be for one year, followed by four optional 12 month terms. A technical quote and price quote are both required for application. The SEC's deadline for submission by prospective data vendors is 12pm EST on July 11, 2019. ",The Block,None,2019-07-06T12:22:01.000Z
1," Bitcoin Cash ABC rose by 0.46% on Friday. Partially reversing a 5% slide from Thursday, Bitcoin Cash ABC ended the day at $400.0. A choppy day saw Bitcoin Cash ABC slide to a mid-morning intraday low $393.06 before finding support. Steering clear of the first major support level at $390.63, Bitcoin Cash ABC rallied to a late morning intraday high $411.50. In spite of the upswing, Bitcoin Cash ABC fell short of the first major resistance level at $413.25 and 23.6% FIB of $418. Easing back through the afternoon, Bitcoin Cash ABC slid back to $396 levels before a late recovery to $400 levels. At the time of writing, Bitcoin Cash ABC was up by 1.13% to $404.5. A bullish start to the day saw Bitcoin Cash ABC rise from a morning low $400.67 to a high $404.5. Bitcoin Cash ABC left the major support and resistance levels untested early on. For the day ahead, a hold above $401.5 would support a run at the first major resistance level at $409.98. Bitcoin Cash ABC would need the continued support of the broader market, however, to take a run on Thursday’s high $411.5. Barring a broad-based crypto rally, Bitcoin Cash ABC would likely fall short of recovery through the 23.6% FIB of $418.0. Failure to hold above $401.5 could see Bitcoin Cash ABC test the first major support level at $391.54. Barring a crypto meltdown, Bitcoin Cash ABC should steer clear of sub-$390 support levels on the day. Litecoin fell by 0.79% on Friday. Following on from a 1.8% fall from Thursday, Litecoin ended the day at $118.54. A choppy morning saw Litecoin fall to a low $116.88 before striking a late morning intraday high $120.85. The early pullback saw Litecoin fall through the 23.6% FIB of $117 to come within range of the first major support level at $116.62. In spite of rebound, Litecoin fell short of the first major resistance level at $124.96. Pulling back through the afternoon, Litecoin fell back through the 23.6% FIB to an intraday low $116.56. Litecoin tested the first major support level at $116.62 for a 2nd time on the day before a recovering to $119 levels. A late pullback saw Litecoin fall back into the red for the day. At the time of writing, Litecoin was up 1.28% to $120.06. Tracking the broader market, Litecoin rose from a morning low $118.41 to a high $120.79 before easing back. Steering clear of the major support levels, the first major resistance level at $120.74 pinned Litecoin back early on. For the day ahead, a hold above $118 levels would support another move through the first major resistance level at $120.74. Litecoin would need support from the broader market, however, to take a run at the second major resistance level at $122.94. Barring a broad-based crypto rally, Thursday’s high $120.85 and the first major resistance level would likely limit any upside. Failure to hold above $118 levels could see Litecoin fall through the 23.6% FIB of $117. The first major support level at $116.45 would likely limit any downside. Ripple’s XRP fell by 2.15% on Friday. Following on from a 4.47% slide from Thursday, Ripple’s XRP ended the day at $0.37948. A bearish start to the day saw Ripple’s XRP slide from an intraday high $0.38920 to a mid-morning intraday low $0.37405. The reversal saw Ripple’s XRP fall through the first major support level at $0.3802. Ripple’s XRP managed to recover to $0.385 levels by late morning before easing back through the 2nd half of the day to sub-$0.38 levels. At the time of writing, Ripple’s XRP was up by 1.34% to $0.38457. A bullish start to the day saw Ripple’s XRP rise from a morning low $0.37936 to a high $0.38612 before easing back. Ripple’s XRP left the major support and resistance levels untested early on. For the day ahead, a hold above $0.3810 levels would support further upside on the day. Ripple’s XRP would need the support of the broader market, however, to break through the first major resistance level at $0.3878. Barring a broad-based crypto rally, Thursday’s high $0.3892 and first major resistance level would likely cap any upside. Failure to hold above $0.3810 levels could see Ripple’s XRP test the first major support level at $0.3726 before any recovery. Barring a broad-based crypto sell-off, Ripple’s XRP will likely steer clear of sub-$0.37 levels on the day. Please let us know what you think in the comments below Thanks, Bob This article was originally posted on FX Empire",Bob Mason,FX Empire,2019-07-06T01:22:40.000Z
