title,article,author,provider,date
California’s Cannabis Delivery Service Now Accepts Bitcoin," SpeedWeed, California’s only legal cannabis delivery platform, announced that it is now accepting Bitcoin (BTC-USD). Customers can now use the popular cryptocurrency to purchase legal marijuana products from licensed dispensaries and have them delivered directly to their door, the company said in a statement. “With banks and credit card companies shying away from the cannabis industry, customers are forced to pay in cash. That’s really inconvenient. We have a better way,” SpeedWeed Director of Operations Ken Breese stated. “By allowing members to pay with crypto, we’re able to keep our promise: SpeedWeed is the safest, most convenient way to have cannabis delivered.” Launched in 2011 as a family business, SpeedWeed has become the largest cannabis delivery platform in America with over 200,000 members and growing. It gained notoriety for delivering medical marijuana to the homes of some of Hollywood’s biggest stars. The post California’s Cannabis Delivery Service Now Accepts Bitcoin appeared first on Market Exclusive.",ME Staff,Market Exclusive,2019-07-03T12:30:04.000Z
The Crypto Daily – The Movers and Shakers 05/07/19," Bitcoin led the way on Thursday, but this time for all the wrong reasons… Bitcoin tumbled by 6.85% on Thursday. Partially reversing Wednesday’s 10.09% rally to end the day at $11,162.5. A bearish start to the day saw Bitcoin fall from an early morning intraday high $12,065 to a late morning low $11,503. The moves through the morning saw Bitcoin leave the major support and resistance levels untested. Finding support through the afternoon, Bitcoin recovered to an afternoon high $11,922 before taking a hit in the final hour. The final hour sell-off saw Bitcoin slide through the 23.6% FIB of $11,275 and first major support level at $11,230.33. For Bitcoin, the only positive of the day was the avoidance of sub-$11,000 levels for the first time since 29th June. Across the rest of the top 10 cryptos, it was red for all but one of the top 10 cryptos on Thursday. Bucking the trend on the day was Binance Coin, which rose by 1.23%. It was deep red for the rest of the pack. Ethereum was close behind Bitcoin, sliding by 6.29%, with EOS (-5.62%) and Bitcoin Cash ABC (-5%) also seeing heavy losses. Things were not much better for Ripple’s XRP and Tron, which fell by 4.47% and 4.7% respectively. Bitcoin Cash SV and Litecoin saw more modest losses on the day. While Bitcoin Cash SV fell by 3.44%, Litecoin fell by just 1.8%. The Bitcoin sell-off on the day led to Bitcoin’s dominance pulling back to 62% levels. At the time of writing, Bitcoin’s dominance stood at 62.5% The total crypto market cap fell from a high $338.45bn to end the day at $319.29bn on Thursday, weighed by Bitcoin’s pullback. At the time of writing, Bitcoin was up by 0.35% to $11,201. Moves in the first hour saw Bitcoin rise from a morning low $11,005 to a high $11,287 before easing back. Whilst leaving the major support and resistance levels untested, Bitcoin broke through the 23.6% FIB of $11,257 before the pullback. Elsewhere, Bitcoin Cash ABC (+0.71%), EOS (+0.23%) and Ethereum (+0.25%) also found early support. Litecoin and Binance Coin struggled at the start, with losses of 0.56% and 0.6% respectively. Bitcoin would need to move back through the 23.6% FIB of $11,257 to $11,430 levels to support a reversal of Thursday’s losses. A move through to $11,500 levels would bring the first major resistance level at $11,800 into play. Bitcoin would need the support of the broader market, however, to break out from this morning’s high $11,287. In the event of a broad-based crypto rally, Bitcoin could touch $12,000 levels before any pullback. Failure to move back through the 23.6% FIB to $11,430 levels could see Bitcoin take another hit. A fall through the morning low $11,005 would bring the first major support level at $10,790 into play before any recovery. Barring a crypto meltdown, Bitcoin should steer well clear of the second major support level at $10,417.5 on the day. Get Into Cryptocurrency Trading Today This article was originally posted on FX Empire",Bob Mason,FX Empire,2019-07-05T01:11:31.000Z
The Top 5 cryptocurrencies latest price," Today the price of Bitcoin is US$$11,158.25; Ethereum is US$290.43; XRP is US$0.389770; Bitcoin Cash is US$401.86 and Litecoin is US$119.90. These are the Top 5 cryptocurrencies by market capitalisation. The top 5 cryptocurrencies are the biggest and most significant cryptocurrencies and constitute the top half of The Top 10 Cryptocurrencies by market capitalisation. In August 2008, the domain name bitcoin.org was registered. On 31st October 2008, a paper was published called “Bitcoin: A Peer-to-Peer Electronic Cash System”. This was authored by Satoshi Nakamoto, the inventor of Bitcoin. To date, no one knows who this person, or people, are. The paper outlined a method of using a P2P network for electronic transactions without “relying on trust”. On 3rd January 2009, the Bitcoin network came into existence. Nakamoto mined block number “0” (or the “genesis block”) which had a reward of 50 Bitcoins. Ripple is a real-time gross settlement system (RTGS) developed by the Ripple company. It is also referred to as the Ripple Transaction Protocol (RTXP) or Ripple protocol. It can trace its roots to 2004 when a web developer called Ryan Fugger had the idea to create a monetary system that was decentralised and could effectively allow individuals to create their own money. Ethereum was launched by Vitalik Buterin on 30th July 2015. He was a researcher and programmer working on Bitcoin Magazine and he initially wrote a white paper in 2013 describing Ethereum. Buterin had proposed that Bitcoin needed a scripting language. He decided to develop a new platform with a more general scripting language when he couldn’t get buy-in to his proposal. Bitcoin Cash was born out of the idea of making Bitcoin more practical for small, day-to-day payments. In May 2017, Bitcoin payments took about four days unless a fee was paid, which was proportionately too large for small transactions. A change to the code was implemented and Bitcoin Cash was born on 1st August 2017. Litecoin was released in October 2011 by Charlie Lee, a former Google employee. It was a fork of Bitcoin with the main difference being a smaller block generation time, increased maximum number of coins, and a different script-based algorithm. We have a range of cryptocurrency guides on our site along with the latest cryptocurrency news. The post The Top 5 cryptocurrencies latest price appeared first on Coin Rivet.",Emma Thompson,Coin Rivet,2019-07-05T10:30:45.000Z
"Bitcoin may soon go parabolic over $12,000 again"," Bitcoin is once more looking bullish as the world’s biggest decentralised asset has found a new influx of buying support to rally close to 20% in price since the start of July. On a backdrop of global turmoils driven by a narrative of trade tensions, a breakout in the gold and commodities markets, and even US President Donald Trump calling out China and Europe specifically for currency manipulation, could this be the perfect storm for Bitcoin to break past resistance and head upwards to fresh 2019 highs? China and Europe playing big currency manipulation game and pumping money into their system in order to compete with USA. We should MATCH, or continue being the dummies who sit back and politely watch as other countries continue to play their games – as they have for many years! — Donald J. Trump (@realDonaldTrump) July 3, 2019  Long-time Bitcoin advocate Andreas Antonopoulos has reminded the community that governments may soon try and “blame crypto for the currency war”, but “the race to the bottom” for state-backed fiat currencies has little to do with the disruptive asset class. Towards the end of last week, Bitcoin continued to grind to defend its five-figure valuation. Unlike other downward price movements that we have seen of late, Bitcoin’s move down did not include any large-scale sell-offs, but instead a series of mini-dumps taking the price down from $12,000 to $10,000. Since this local bottom was hit, we have seen volumes pick up and buyers come back into the market to drive the price back up to the same level where the ‘controlled’ sell-off began. If Bitcoin can now penetrate through the $12,000-$12,400 level of resistance, the move back up to $14,000 and beyond may be quicker than its initial parabolic rise in late June. If the digitally-scarce asset does decide to rally up from this point, the odds of ever seeing an exchange-traded price of under $10,000 will decrease exponentially as fast as any potential move in the opposite direction. Bitcoin will become the global reserve currency. That is why we are all here.  Anything short of this becomes much less interesting. — Pomp 🌪 (@APompliano) July 4, 2019    The popular Bitcoin analyst Anthony “Pomp” Pompliano recently outlined his $100,000 Bitcoin target for the end of 2021, but the chances are that if we do see all-time highs broken sooner rather than later, a six-figure valuation for Bitcoin may become a reality quicker than even the most bullish commentators in the space would ever expect. For more news, guides, and cryptocurrency analysis, click here. The post Bitcoin may soon go parabolic over $12,000 again appeared first on Coin Rivet.",Nawaz Sulemanji,Coin Rivet,2019-07-04T14:10:19.000Z
"Bitcoin Cash – ABC, Litecoin and Ripple Daily Analysis – 07/07/19"," Bitcoin Cash ABC rose by 1.59% on Saturday. Following on from a 0.46% gain from Friday, Bitcoin Cash ABC ended the day at $407.05. A mixed start to the day saw Bitcoin Cash ABC rise from an intraday low $400.67 to a morning high $406.43 before easing back to $401 levels. Steering clear of the major support and resistance levels, Bitcoin Cash ABC rallied to a late afternoon intraday high $416.8. Bitcoin Cash ABC broke through the first major resistance level at $409.98. Falling short of the 23.6% FIB of $418, Bitcoin Cash ABC pulled back to sub-$410 levels late in the day. At the time of writing, Bitcoin Cash ABC was down by 1.15% to a morning low $402.37. A mixed start to the day saw Bitcoin Cash ABC rise to a morning high $406.63 before falling into the red. Bitcoin Cash ABC left the major support and resistance levels untested early on. For the day ahead, a move through to $408 levels would support a run at the first major resistance level at $415.68. Barring a broad-based crypto rally, the first major resistance level and Saturday’s high $416.8 would cap any upside on the day. Failure to move through to $408 levels could see Bitcoin Cash ABC fall deeper into the red. A fall through the first major support level at $399.55 would bring the second major support level at $392.04 into play. Barring a crypto meltdown, Bitcoin Cash ABC should steer clear of sub-$390 levels. Litecoin slipped by 0.18% on Saturday. Following on from a 0.79% fall from Friday, Litecoin ended the day at $118.25. A bullish start to the day saw Litecoin hit a morning high $120.91. Coming up against the first major resistance level at $120.74 Litecoin pulled back to a morning low $118.18. Steering clear of the 23.6% FIB of $117 and first major support level at $116.27, Litecoin rallied to a late afternoon intraday high $122.29. Litecoin broke back through the first major resistance level at $120.74 before sliding to a late intraday low $117.3. Finding support at the 23.6% FIB of $117, Litecoin recovered to $118 levels to limit the downside on the day. At the time of writing, Litecoin was down by 0.18% to $118.04. A choppy start to the day saw Litecoin rise from a morning low $117.43 to a high $119.14 before easing back. Litecoin left the major support and resistance levels untested early on. For the day ahead, a move back through the morning high to $119.30 levels would support a run at the first major resistance level at $121.26. Litecoin would need the support of the broader market, however, to break clear of $120. Barring a broad-based crypto rally, Saturday’s high $122.29 should limit the upside on the day. Failure to move through to $119.30 levels could see Litecoin slide back to $117 levels. In the event of an extended sell-off, Litecoin could fall through the 23.6% FIB of $117 to test the first major support level at $116.37 before any recovery. Ripple’s XRP rallied by 3.08% on Saturday. Reversing a 2.15% fall from Friday, Ripple’s XRP ended the day at $0.39155. Tracking the broader market, Ripple’s XRP rose from an intraday low $0.37936 to a morning high $0.38738. Ripple’s XRP came within range the first major resistance level at $0.3878 before easing back to $0.381 levels. An early afternoon rally saw Ripple’s XRP strike an intraday high $0.41113 before sliding back to sub-$0.39 levels. The rally saw Ripple’s XRP break through the first major resistance level at $0.3878 and second major resistance level at $0.3061. Ripple’s XRP came up against the third major resistance level at $0.4112 before the reversal. At the time of writing, Ripple’s XRP was down by 0.6% to $0.38921. A bearish start to the day saw Ripple’s XRP fall from a morning high $0.39199 to a low $0.38820 before steadying. Ripple’s XRP left the major support and resistance levels untested early on. For the day ahead, a move through to $0.3940 levels would support a return to $0.40 levels. Ripple’s XRP would need the support of the broader market, however, to take a run at the first major resistance level at $0.4087. In the event of a broad-based crypto rebound, the 23.6% FIB of $0.4164 would likely limit any upside on the day. Failure to move through to $0.3940 levels could see Ripple’s XRP slide through the morning low to sub-$0.3850 levels. Barring an extended crypto sell-off, however, Ripple’s XRP should steer clear of the first major support level at $0.3769. Please let us know what you think in the comments below Thanks, Bob This article was originally posted on FX Empire",Bob Mason,FX Empire,2019-07-07T03:48:35.000Z
Coinsquare buys majority stake in Just Cash in bid to make world’s ATMs crypto-friendly," Cryptocurrency trading platform Coinsquare is making a bid to make digital assets more accessible.  Coinsquare has announced it has made a controlling investment in software provider Just Cash, whose tech will allow any ATM to sell cryptocurrency. The software does not disrupt the ATM network, no hardware changes are required and there are no additional costs to the operator. Coinsquare CEO Cole Diamond believes crypto-friendly ATMs are key to making digital assets accessible to the masses.  “Right now, there is a lack of mainstream cryptocurrency adoption because most people are intimidated by the process to acquire it,” said Diamond. “By using the millions of existing ATMs around the world, we can now bridge the gap and give new users the easiest and most familiar experience to purchase cryptocurrency.”",Carol Gaszcz,The Block,2019-07-04T14:33:48.000Z
Casa rolls out cryptocurrency mobile app to attract bitcoin novices," Cryptocurrency custody startup Casa has rolled out a new mobile app.  Sats App is a noncustodial wallet that allows users to manage their lightning nodes straight from their mobile phone, CoinDesk writes. Casa is planning to add a rewards program to attract more cryptocurrency early adopters, who can earn cryptocurrency and learn about cryptocurrencies and node management. “Features are focused on increasing adoption of bitcoin and lightning nodes,” said Casa CEO Jeremy Welch. “You will be able to earn bitcoin if you don’t have a Casa node, but you will be able to earn bitcoin faster if you have a node.” The app will currently be available only to Casa customers, with a full roll-out planned for later this month. According to Welch, although the app is “lightweight,” it offers multiple actions — earning sats and operating a full node. “It’s private, secure and connects over Tor,” he added. Earlier this year, Casa announced a “core shift” to its business, launching the Keymaster mobile app and plug-and-play Bitcoin Lightning node Casa Node. ",Carol Gaszcz,The Block,2019-07-03T22:20:18.000Z
Is Libra crypto’s best gateway drug to date?," It turned out to be true. The rumours and speculation that arose when Facebook began advertising job openings for blockchain engineers were right. Facebook’s first foray into cryptocurrency is coming – first dubbed ‘Facebook Coin’, then ‘Global Coin’, and now officially announced as Libra with the release of the white paper. The way the white paper reads reminds me a lot of Stellar Lumens and what it is aiming to accomplish. Facebook could have just built on top of Stellar, but it likely saw too little profit and too little control with that approach. The approach Facebook is taking is to invite 100 organisations to become members of the Libra Association. The social media giant is also charging $10 million for the privilege of running a node on the network to validate transactions. Like Stellar, the Libra Association is a non-profit organisation, the purpose of which is to coordinate activity relating to the growth of the Libra ecosystem. The founding members are listed in the white paper and feature many household names such as PayPal, Visa, Mastercard, eBay, and Uber. It’s at this point we have another instance of something I mentioned in a previous article. In that post, I mentioned how the masses are not interested in investing a lot of time researching and thinking about new technologies in order to derive trust from understanding. They much prefer to wait for a signal from an organisation they see as an authority and just assume that organisation has done the research and thinking for them. This is principally why I ask whether Libra will become the best gateway drug for the existing cryptocurrency industry. More than two billion users log in to Facebook each day. With a bank of attention like that, Facebook can jump to the front of the line of advertisers and provide instant exposure to any new feature or product. The minimal amount of effort born out of it being integrated with Facebook avoids the apathy that has no doubt hindered Bitcoin adoption among Facebook users. If you think back to another one of my articles about the new Voice social network, you may notice that they share a similar obstacle – the requirement to verify your identity. The conflict I see there with Libra is that it is designed for financial inclusion but will struggle to verify the identity of people in countries that don’t have a working government ID system that is digital. There is however a part of the white paper that states: “The Libra Blockchain is pseudonymous and allows users to hold one or more addresses that are not linked to their real-world identity.” So we will have to see how that manifests in the final product. The big question is this: how close to the original white paper will Libra end up being? The US Congress is already calling for Facebook to slow down if not stop development of Libra until they have had a chance to get their head around it and determine what kind of risks it poses to consumers. It is likely that the original vision for Libra will become diluted by regulation before it is launched. Keep your eye on the headlines for news on how this develops. A gateway drug is what we call something that is a mild introduction to something that gets the user hooked before they trade up to something stronger. This may be what happens when Libra is launched. Facebook will do all the work of introducing the concept of a cryptocurrency to its huge user base, get them used to it, and then it’s a much smaller leap for those users to adopt Bitcoin. Here is an illustration of the process of buying Libra, provided by Facebook: All it would take is for one of the cryptocurrency exchanges to create a market that allows Libra to trade against Bitcoin and the average Facebook user has a way of buying Libra with their national currency and exchanging it for Bitcoin. Even if regulation doesn’t allow cryptocurrency exchanges to list Libra, it will undoubtedly end up on decentralised or peer-to-peer markets such as OpenBazaar, with individuals trading it directly between themselves. Is there a darker side to Libra? The post Is Libra crypto’s best gateway drug to date? appeared first on Coin Rivet.",Chris Coney,Coin Rivet,2019-07-03T15:00:56.000Z
Andreas Antonopoulos wants people to stick with crypto," In a recent interview on London Real, the Bitcoin and open blockchain advocate Andreas Antonopoulos talked about the wrong type of people entering the digital asset economy, and why many end up staying for different reasons other than price. On the topic of the many hype-based cryptocurrency projects we see today, Antonopoulos said that the industry sometimes attracts the wrong type of crowd into the ecosystem. “It attracts scammers, opportunists, pump and dumpers, and pyramid schemes, and the ICO market enabled a lot of those people to make their own coins.” Andreas said that one of the reasons the ICO craze happened was because Ethereum made it easy for people to build a scalable, secure, transferable, and censorship-resistant blockchain “just by writing 20 lines of code”. But the Mastering Ethereum author said that in the first 2017 wave of mania, people used these newly-created programmable blockchains “to build platforms to do massive pump and dumps” instead of building projects focused on privacy and censorship resistance. However, he did mention that in the long run, “if you can fund start-ups with an international pool of investors, that can change the investment fields”. FOMO is in the air. Newbies are joining the cryptocurrency space and falling prey to scammers.  Please educate your friends and family:– Promises of profit are 100% ponzi– Request to ""recruit"", ""affiliate"" etc are 100% pyramid schemes– ICO/IEO are 99.99% pump-and-dump — Andreas M. Antonopoulos (@aantonop) June 20, 2019  Regarding the parabolic rises and falls of many crypto assets, Andreas said that “nothing goes exponential without going down”, and that Bitcoin has done this eight times already as “that’s how it grows”. “The reason it grows like this is that there isn’t much in terms of short pressure to hold it down,” he said. “If you’ve got something that has limited supply and you suddenly have a speculative mania that blows up, it will continue to go up in a straight line, which only further fuels the mania. “Until it reaches a point where there simply isn’t anybody else who feels just as enthusiastic and it pauses for a second, the panic just drives [the price] down.” Andreas said that there’s “no difference between speculators and investors” and that they’re just speculating with a different risk profile, with some of them doing so “with very little research and information”. He said that the reason this is bad is that “a lot of good, innocent, and slightly naive people lost a lot of money” and had their lives destroyed because of this. This has a negative effect “as it changes the community” and “causes damage to the community”. “You have a lot of drama that comes up when there’s money on the table – people’s personalities change.” He said that people start taking shortcuts and their ethics become compromised – “power corrupts, money corrupts”. Andreas said that the majority of people first got involved in crypto most likely “because they heard that it’s some kind of investment opportunity”. He made the case that even though many of these people may have first entered the space “because of speculation and mania”, the people who were only motivated by price left during the 2018 crash, with those who stayed “finding other motivations”. He claimed some of the reasons why people stay is because they like the community, they understand the technology, and they may even be “driven by the political implications”. To those people, Andreas said: “Welcome, you may have come because you want to get rich – that’s okay. Now let me tell you about why you should stay because of the technology even after the price crashes.”   The post Andreas Antonopoulos wants people to stick with crypto appeared first on Coin Rivet.",Nawaz Sulemanji,Coin Rivet,2019-07-03T13:00:11.000Z
